{
	"$schema": "http://json-schema.org/draft-07/schema#",
	"title": "ServerConfig",
	"type": "object",
	"additionalProperties": false,
	"required": [
		"replayFolderPaths",
		"timeoutTicks",
		"timeoutMs",
		"clientWaitTimeoutMs",
		"clientConnectTimeoutMs",
		"clientPacketsMaxSizeKb"
	],
	"properties": {
		"replayFolderPaths": {
			"type": "array",
			"minItems": 1,
			"items": {
				"type": "string",
				"minLength": 1
			}
		},
		"timeoutTicks": {
			"type": "integer",
			"minimum": 1
		},
		"timeoutMs": {
			"type": "integer",
			"minimum": 1
		},
		"clientWaitTimeoutMs": {
			"type": "integer",
			"minimum": 1
		},
		"clientConnectTimeoutMs": {
			"type": "integer",
			"minimum": 1
		},
		"clientPacketsMaxSizeKb": {
			"type": "integer",
			"minimum": 1
		}
	}
}
