{
    "replayFolderPaths": [
        "/workspace/replays",
        "/workspaces/monorepo",
        "/workspaces/monorepo/visualizer/public/replays",
        "./replays"
    ],
    "timeoutTicks": 30000,
    "timeoutMs": 3000000,
    "clientWaitTimeoutMs": 30000,
    "clientConnectTimeoutMs": 30000,
    "clientPacketsMaxSizeKb": 16
}
